{"$id":"https://locus.invalid/schemas/managed-performance-scenario-manifest-v2.schema.json","$schema":"https://json-schema.org/draft/2020-12/schema","additionalProperties":false,"properties":{"attempt_statuses":{"type":"array"},"evidence_profile_id":{"const":"LOCUS-managed-performance-evidence-profile-v2"},"format_id":{"const":"LOCUS-managed-performance-scenario-manifest-v2"},"fresh_project_count":{"const":12},"invalid_categories":{"type":"array"},"measured_slot_count":{"const":312},"methodology_id":{"const":"LOCUS-managed-performance-methodology-v2"},"methodology_sha256":{"pattern":"^[0-9a-f]{64}$","type":"string"},"scenario_slot_counts":{"type":"object"},"scenarios":{"type":"object"},"scheduled_slot_count":{"const":324},"slot_digest":{"pattern":"^[0-9a-f]{64}$","type":"string"},"status":{"const":"assigned"}},"required":["format_id","evidence_profile_id","methodology_id","methodology_sha256","scenarios","scenario_slot_counts","scheduled_slot_count","measured_slot_count","fresh_project_count","slot_digest","attempt_statuses","invalid_categories","status"],"type":"object"}
