{"attempt_statuses":["warmup-passed","valid-success","valid-expected-rejection","infrastructure-invalid"],"evidence_profile_id":"LOCUS-managed-performance-evidence-profile-v2","format_id":"LOCUS-managed-performance-scenario-manifest-v2","fresh_project_count":12,"invalid_categories":["build-failure","startup-failure","health-check-failure","host-interruption","orchestrator-failure","provider-unavailable-outside-schedule","measurement-integrity-failure","cleanup-failure"],"measured_slot_count":312,"methodology_id":"LOCUS-managed-performance-methodology-v2","methodology_sha256":"f9adcb03196690aa3d4b073efc5e9196858ea64710a27969fa52d3a8df2e332f","scenario_slot_counts":{"AP00":12,"AP01":60,"AP02":60,"AP03":60,"AP04":60,"AP05":60,"AP06":12},"scenarios":{"AP00":{"category":"warmup","measured":false,"name":"warmup"},"AP01":{"category":"central","measured":true,"name":"enrollment"},"AP02":{"category":"central","measured":true,"name":"package-transfer-and-clean-bootstrap"},"AP03":{"category":"central","measured":true,"name":"successful-recovery"},"AP04":{"category":"central","measured":true,"name":"wrong-input-rejection"},"AP05":{"category":"central","measured":true,"name":"one-party-unavailable-recovery"},"AP06":{"category":"structural","measured":true,"name":"storage-and-role-snapshot"}},"scheduled_slot_count":324,"slot_digest":"cdb06af292cc9ca54ec3f7abdd920618a1895b58fc43b2fb3741325d92368078","status":"assigned"}
